{
  "name": "navi-bootstrap",
  "version": "0.1.1",
  "description": "Jinja2 rendering engine and template packs for bootstrapping projects",
  "license": "MIT",
  "language": "python",
  "python_version": "3.12",

  "author": {
    "name": "Nelson Spencer"
  },

  "structure": {
    "src_dir": "src/navi_bootstrap",
    "test_dir": "tests"
  },

  "dependencies": {
    "runtime": ["click", "jinja2", "pyyaml", "jsonschema"],
    "dev": [
      "pytest", "pytest-cov", "ruff", "mypy", "bandit",
      "types-jsonschema", "types-PyYAML"
    ],
    "optional": {}
  },

  "features": {
    "ci": true,
    "pre_commit": true
  },

  "github": {
    "org": "Project-Navi",
    "repo": "navi-bootstrap"
  },

  "release": {
    "has_docker": false
  },

  "recon": {
    "test_framework": "pytest",
    "test_count": 325,
    "coverage_pct": 93,
    "python_test_versions": ["3.12", "3.13"],
    "codeql_languages": ["python"],
    "existing_ci": [
      "_build-reusable.yml",
      "codeql.yml",
      "release.yml",
      "scorecard.yml",
      "tests.yml"
    ],
    "existing_tools": {
      "ruff": true,
      "mypy": true,
      "bandit": true,
      "pre_commit": true,
      "dependabot": true
    },
    "has_pyproject_toml": true,
    "has_github_dir": true,
    "updated_at": "2026-02-28T00:00:00+00:00"
  }
}
